{
  "schema_version": "1",
  "id": "report_demo_01",
  "class_id": "class_g7a_demo",
  "lesson_id": "lesson_g7_inverse_proportion_01",
  "generated_at": "2026-07-18T02:00:00Z",
  "outcome_counts": {
    "passed_transfer": 1,
    "still_struggling": 1,
    "root_cause_reclassified": 1,
    "incomplete": 1,
    "teacher_escalation": 1
  },
  "student_outcomes": [
    {
      "student_id": "stu_g7_001",
      "outcome": "passed_transfer",
      "evidence_ids": ["ev_stu_g7_001_001", "ev_stu_g7_001_002"]
    },
    {
      "student_id": "stu_g7_002",
      "outcome": "still_struggling",
      "evidence_ids": ["ev_stu_g7_002_001"]
    },
    {
      "student_id": "stu_g7_003",
      "outcome": "root_cause_reclassified",
      "evidence_ids": ["ev_stu_g7_003_001"]
    },
    {
      "student_id": "stu_g7_004",
      "outcome": "teacher_escalation",
      "evidence_ids": ["ev_stu_g7_004_001", "ev_stu_g7_004_002"]
    },
    {
      "student_id": "stu_g7_005",
      "outcome": "incomplete",
      "evidence_ids": []
    }
  ],
  "remaining_gaps": [
    {
      "skill_id": "skill_fraction_multiplication",
      "student_ids": ["stu_g7_002", "stu_g7_004"]
    },
    {
      "skill_id": "skill_inverse_proportion_definition",
      "student_ids": ["stu_g7_003"]
    }
  ],
  "next_lesson_focus": "Re-teach inverse-proportion setup and fraction multiplication before work-rate transfer.",
  "printable_lesson_plan_id": "plan_class_g7a_demo_lesson_g7_inverse_proportion_01"
}
